<?xml version="1.0" encoding="UTF-8" standalone="yes"?>
<lev:Leveringsinformatie xmlns:lev="http://www.kadaster.nl/schemas/klic/20080722/leveringsinfo" xmlns:gml="http://www.opengis.net/gml" xmlns:ns3="http://www.w3.org/1999/xlink" xmlns:ns4="http://www.w3.org/2001/SMIL20/" xmlns:ns5="http://www.w3.org/2001/SMIL20/Language" xmlns:xsi="http://www.w3.org/2001/XMLSchema-instance" xsi:schemaLocation="http://www.kadaster.nl/schemas/klic/20080722/leveringsinfo file:///U:/Services/RVTs/KLIC/Systeemdocumentatie/75%20Interface%20specificaties/DomeinKlic/Leveringsinformatie/LeveringsInfo-2.0.xsd">
	<lev:Version>2.0</lev:Version>
	<lev:Aanvraag>
		<lev:Klicnummer>15G357840</lev:Klicnummer>
		<lev:Ordernummer>9806502397</lev:Ordernummer>
		<lev:Positienummer>10</lev:Positienummer>
		<lev:RelatienummerAanvrager>0000648756</lev:RelatienummerAanvrager>
		<lev:Meldingsoort>Graafmelding</lev:Meldingsoort>
		<lev:DatumTijdAanvraag>2015-09-28T08:33:16.000+02:00</lev:DatumTijdAanvraag>
		<lev:KlantReferentie>Mijn ref.: 2016-07-19 versie 2.0</lev:KlantReferentie>
		<lev:Gebiedspolygoon srsName="epsg:28992" srsDimension="2" axisLabels="x y" uomLabels="m m">
			<gml:exterior>
				<gml:LinearRing>
					<gml:posList>117395 487103 117391 487061 117534 487027 117659 486997 117785 486977 117830 486980 117833 487014 117689 487024 117597 487044 117496 487072 117395 487103</gml:posList>
				</gml:LinearRing>
			</gml:exterior>
		</lev:Gebiedspolygoon>
		<lev:Informatiepolygoon srsName="epsg:28992" srsDimension="2" axisLabels="x y" uomLabels="m m">
			<gml:exterior>
				<gml:LinearRing>
					<gml:posList>117395 487103 117391 487061 117534 487027 117659 486997 117785 486977 117830 486980 117833 487014 117689 487024 117597 487044 117496 487072 117395 487103</gml:posList>
				</gml:LinearRing>
			</gml:exterior>
		</lev:Informatiepolygoon>
		<lev:GeselecteerdGebiedKaart>
			<lev:Bestandsnaam>bronnen/SEL_15G357840.png</lev:Bestandsnaam>
		</lev:GeselecteerdGebiedKaart>
		<lev:Pngformaat>
			<lev:OmsluitendeRechthoek>
				<gml:Envelope srsName="epsg:28992" srsDimension="2" axisLabels="x y" uomLabels="m m">
					<gml:lowerCorner>117391 486977</gml:lowerCorner>
					<gml:upperCorner>117833 487103</gml:upperCorner>
				</gml:Envelope>
			</lev:OmsluitendeRechthoek>
			<lev:PixelsBreed>6188</lev:PixelsBreed>
			<lev:PixelsHoog>1764</lev:PixelsHoog>
		</lev:Pngformaat>
		<lev:Ontvangstbevestiging>
			<lev:Bestandsnaam>Ontvangstbevestiging_15G357840.pdf</lev:Bestandsnaam>
		</lev:Ontvangstbevestiging>
	</lev:Aanvraag>
	<lev:Leveringsvolgnummer>1</lev:Leveringsvolgnummer>
	<lev:IndicatieLeveringCompleet>true</lev:IndicatieLeveringCompleet>
	<lev:Leveringsbrief>
		<lev:Bestandsnaam>LI_15G357840_1.pdf</lev:Bestandsnaam>
	</lev:Leveringsbrief>
	<lev:Ondergrondkaarten>
		<lev:SoortOndergrondkaart>bgtBestaand</lev:SoortOndergrondkaart>
		<lev:Ondergrondkaart>
			<lev:Bestandsnaam>bronnen/GB_15G357840.png</lev:Bestandsnaam>
		</lev:Ondergrondkaart>
	</lev:Ondergrondkaarten>
	<lev:Ondergrondkaarten>
		<lev:SoortOndergrondkaart>bgtPlan</lev:SoortOndergrondkaart>
		<lev:Ondergrondkaart>
			<lev:Bestandsnaam>bronnen/GP_15G357840.png</lev:Bestandsnaam>
		</lev:Ondergrondkaart>
	</lev:Ondergrondkaarten>
	<lev:GebundeldeNetinformatie>
		<lev:Bestandsnaam>NI_netinformatie_15G357840_1</lev:Bestandsnaam>
	</lev:GebundeldeNetinformatie>
	<lev:NetbeheerderLeveringen>
		<lev:Netbeheerder>
			<lev:Bronhoudercode>KL0002</lev:Bronhoudercode>
			<lev:RelatienummerNetbeheerder>0000574962</lev:RelatienummerNetbeheerder>
			<lev:Bedrijfsnaam>Liander</lev:Bedrijfsnaam>
			<lev:BedrijfsnaamAfkorting>Liander</lev:BedrijfsnaamAfkorting>
			<lev:Contact>
				<lev:Telefoon>0611 382 570</lev:Telefoon>
			</lev:Contact>
			<lev:Contactpersoon>
				<lev:Naam>Gis Data Klic</lev:Naam>
				<lev:Telefoon>0611382570</lev:Telefoon>
				<lev:Email>infoklic@alliander.com</lev:Email>
			</lev:Contactpersoon>
			<lev:Storingsnummer>0800-9009</lev:Storingsnummer>
		</lev:Netbeheerder>
		<lev:BetrokkenBijAanvraag>true</lev:BetrokkenBijAanvraag>
		<lev:Netinformatie>
			<lev:Bestandsnaam>bronnen/KL0002/NI_netinformatie_KL0002_15G357840.xml</lev:Bestandsnaam>
		</lev:Netinformatie>
		<lev:Themas>
			<lev:Thema>gasHogeDruk</lev:Thema>
			<lev:Themanaam>gas hoge druk</lev:Themanaam>
			<lev:Toezichthouders>
				<lev:Telefoon>0881912211</lev:Telefoon>
			</lev:Toezichthouders>
			<lev:EisVoorzorgmaatregel>false</lev:EisVoorzorgmaatregel>
			<lev:Ligging>
				<lev:Bestandsnaam>bronnen/KL0002/LG_gas+hoge+druk_Liander_0000574962_15G357840.png</lev:Bestandsnaam>
			</lev:Ligging>
			<lev:Annotatie>
				<lev:Bestandsnaam>bronnen/KL0002/AN_gas+hoge+druk_Liander_0000574962_15G357840.png</lev:Bestandsnaam>
			</lev:Annotatie>
			<lev:ThemaBijlagen>
				<lev:SoortThemaBijlage>profielschets</lev:SoortThemaBijlage>
				<lev:Bijlage>
					<lev:Bestandsnaam>bronnen/KL0002/nl.imkl.KL0002.Profielschets_gasHogeDruk_Liander_detail_A4_20.pdf</lev:Bestandsnaam>
				</lev:Bijlage>
			</lev:ThemaBijlagen>
		</lev:Themas>
		<lev:Themas>
			<lev:Thema>hoogspanning</lev:Thema>
			<lev:Themanaam>hoogspanning</lev:Themanaam>
			<lev:Toezichthouders>
				<lev:Telefoon>0653550024</lev:Telefoon>
			</lev:Toezichthouders>
			<lev:EisVoorzorgmaatregel>true</lev:EisVoorzorgmaatregel>
			<lev:Ligging>
				<lev:Bestandsnaam>bronnen/KL0002/LG_hoogspanning_Liander_0000574962_15G357840.png</lev:Bestandsnaam>
			</lev:Ligging>
			<lev:Maatvoering>
				<lev:Bestandsnaam>bronnen/KL0002/MV_hoogspanning_Liander_0000574962_15G357840.png</lev:Bestandsnaam>
			</lev:Maatvoering>
			<lev:Annotatie>
				<lev:Bestandsnaam>bronnen/KL0002/AN_hoogspanning_Liander_0000574962_15G357840.png</lev:Bestandsnaam>
			</lev:Annotatie>
			<lev:ThemaBijlagen>
				<lev:SoortThemaBijlage>eisVoorzorgsmaatregel</lev:SoortThemaBijlage>
				<lev:Bijlage>
					<lev:Bestandsnaam>bronnen/KL0002/nl.imkl.KL0002.EV_hoogspanning_15G357840_EVBrief_Liander_model12.pdf</lev:Bestandsnaam>
				</lev:Bijlage>
			</lev:ThemaBijlagen>
		</lev:Themas>
		<lev:Themas>
			<lev:Thema>middenspanning</lev:Thema>
			<lev:Themanaam>middenspanning</lev:Themanaam>
			<lev:Toezichthouders>
				<lev:Telefoon>0881912211</lev:Telefoon>
			</lev:Toezichthouders>
			<lev:EisVoorzorgmaatregel>false</lev:EisVoorzorgmaatregel>
			<lev:Ligging>
				<lev:Bestandsnaam>bronnen/KL0002/LG_middenspanning_Liander_0000574962_15G357840.png</lev:Bestandsnaam>
			</lev:Ligging>
			<lev:Maatvoering>
				<lev:Bestandsnaam>bronnen/KL0002/MV_middenspanning_Liander_0000574962_15G357840.png</lev:Bestandsnaam>
			</lev:Maatvoering>
			<lev:Annotatie>
				<lev:Bestandsnaam>bronnen/KL0002/AN_middenspanning_Liander_0000574962_15G357840.png</lev:Bestandsnaam>
			</lev:Annotatie>
		</lev:Themas>
		<lev:Themas>
			<lev:Thema>middenspanning</lev:Thema>
			<lev:Themanaam>datatransport</lev:Themanaam>
			<lev:Toezichthouders>
				<lev:Telefoon>0881912211</lev:Telefoon>
			</lev:Toezichthouders>
			<lev:EisVoorzorgmaatregel>false</lev:EisVoorzorgmaatregel>
			<lev:Ligging>
				<lev:Bestandsnaam>bronnen/KL0002/LG_datatransport_Liander_0000574962_15G357840.png</lev:Bestandsnaam>
			</lev:Ligging>
			<lev:Maatvoering>
				<lev:Bestandsnaam>bronnen/KL0002/MV_datatransport_Liander_0000574962_15G357840.png</lev:Bestandsnaam>
			</lev:Maatvoering>
			<lev:Annotatie>
				<lev:Bestandsnaam>bronnen/KL0002/AN_datatransport_Liander_0000574962_15G357840.png</lev:Bestandsnaam>
			</lev:Annotatie>
			<lev:ThemaBijlagen>
				<lev:SoortThemaBijlage>profielschets</lev:SoortThemaBijlage>
				<lev:Bijlage>
					<lev:Bestandsnaam>bronnen/KL0002/nl.imkl.KL0002.Profielschets_datatransport_Liander_detail_A4_22.pdf</lev:Bestandsnaam>
				</lev:Bijlage>
			</lev:ThemaBijlagen>
		</lev:Themas>
		<lev:Themas>
			<lev:Thema>middenspanning</lev:Thema>
			<lev:Themanaam>gas lage druk</lev:Themanaam>
			<lev:Toezichthouders>
				<lev:Telefoon>0881912211</lev:Telefoon>
			</lev:Toezichthouders>
			<lev:EisVoorzorgmaatregel>false</lev:EisVoorzorgmaatregel>
			<lev:Ligging>
				<lev:Bestandsnaam>bronnen/KL0002/LG_gas+lage+druk_Liander_0000574962_15G357840.png</lev:Bestandsnaam>
			</lev:Ligging>
			<lev:Annotatie>
				<lev:Bestandsnaam>bronnen/KL0002/AN_gas+lage+druk_Liander_0000574962_15G357840.png</lev:Bestandsnaam>
			</lev:Annotatie>
			<lev:ThemaBijlagen>
				<lev:SoortThemaBijlage>profielschets</lev:SoortThemaBijlage>
				<lev:Bijlage>
					<lev:Bestandsnaam>bronnen/KL0002/nl.imkl.KL0002.Profielschets_GLD_7344XA21_detail_A4_21.pdf</lev:Bestandsnaam>
				</lev:Bijlage>
			</lev:ThemaBijlagen>
		</lev:Themas>
		<lev:Themas>
			<lev:Thema>middenspanning</lev:Thema>
			<lev:Themanaam>laagspanning</lev:Themanaam>
			<lev:Toezichthouders>
				<lev:Telefoon>0881912211</lev:Telefoon>
			</lev:Toezichthouders>
			<lev:EisVoorzorgmaatregel>false</lev:EisVoorzorgmaatregel>
			<lev:Ligging>
				<lev:Bestandsnaam>bronnen/KL0002/LG_laagspanning_Liander_0000574962_15G357840.png</lev:Bestandsnaam>
			</lev:Ligging>
			<lev:Maatvoering>
				<lev:Bestandsnaam>bronnen/KL0002/MV_laagspanning_Liander_0000574962_15G357840.png</lev:Bestandsnaam>
			</lev:Maatvoering>
			<lev:Annotatie>
				<lev:Bestandsnaam>bronnen/KL0002/AN_laagspanning_Liander_0000574962_15G357840.png</lev:Bestandsnaam>
			</lev:Annotatie>
			<lev:ThemaBijlagen>
				<lev:SoortThemaBijlage>profielschets</lev:SoortThemaBijlage>
				<lev:Bijlage>
					<lev:Bestandsnaam>bronnen/KL0002/nl.imkl.KL0002.Profielschets_LS_7344XA19_detail_A4_19.pdf</lev:Bestandsnaam>
				</lev:Bijlage>
			</lev:ThemaBijlagen>
		</lev:Themas>
		<lev:Bijlagen>
			<lev:SoortBijlage>algemeen</lev:SoortBijlage>
			<lev:Bijlage>
				<lev:Bestandsnaam>bronnen/KL0002/nl.imkl.KL0002.ALG_Liander_BriefAlgemeen-v1.1_15G357840.pdf</lev:Bestandsnaam>
			</lev:Bijlage>
		</lev:Bijlagen>
		<lev:Bijlagen>
			<lev:SoortBijlage>BL</lev:SoortBijlage>
			<lev:Bijlage>
				<lev:Bestandsnaam>bronnen/KL0002/BL_Liander_0000574962_15G357840_OntwerpContouren.pdf</lev:Bestandsnaam>
			</lev:Bijlage>
		</lev:Bijlagen>
		<lev:Ondergrondkaarten>